{
  "catalog_schema": 1,
  "edges": [
    {
      "carry_unresolved_semantic_state": true,
      "edge_sha256": "8be31e5ce03ad981093569964c4635ac5e1629363d7c06c5000191201aea8123",
      "from": "1.0.0",
      "guidance_paths": [
        "1.0.0-to-1.0.1/UPGRADE.md"
      ],
      "migration_ids": [],
      "semantic_review_required": true,
      "to": "1.0.1"
    },
    {
      "carry_unresolved_semantic_state": true,
      "edge_sha256": "42b5c7bac7582ac88a198b309a854f2de530b2498c99a371045c182212af1cf2",
      "from": "1.0.1",
      "guidance_paths": [],
      "migration_ids": [],
      "semantic_review_required": false,
      "to": "1.0.2"
    }
  ],
  "guidance": [
    {
      "from_version": "1.0.0",
      "guidance_id": "stable-1-project-contract",
      "path": "1.0.0-to-1.0.1/UPGRADE.md",
      "sha256": "f1fc0f7b215cf7acb9f7e48e5e9479f95b536b0d9de8c1ebdc10b6eaa0544ecb",
      "supersedes": [],
      "to_version": "1.0.1"
    }
  ],
  "supported_sources": [
    "1.0.0",
    "1.0.1"
  ],
  "target_version": "1.0.2"
}
